<?xml version = "1.0" encoding = "UTF-8"?>
<breakdown xmlns:xsi = "http://www.w3.org/2001/XMLSchema-instance" xsi:noNamespaceSchemaLocation = "C:\\Users\\i-am-\\OneDrive - Singapore Management University\\Year 2\\EI\\Project\\EI_Project\\TrainBreakDown\\new_breakdown.xsd">
	<train_id>3</train_id>
	<faultType>Train Fault</faultType>
	<timestamp>22/03/18 15:00</timestamp>
	<coordinates>
		<lat>1.3272383</lat>
		<long>103.9443528</long>
	</coordinates>
	<remark>Tanah Merah Station</remark>
</breakdown>
